id,name
372,"부분적분법을 이해하고, 이를 활용할 수 있다."
373,함수 y = x^n (n은 실수)의 부정적분과 정적분을 구할 수 있다.
374,지수함수와 로그함수의 부정적분과 정적분을 구할 수 있다.
375,삼각함수의 부정적분과 정적분을 구할 수 있다.
376,정적분과 급수의 합 사이의 관계를 이해하고 이를 활용할 수 있다.
377,곡선으로 둘러싸인 도형의 넓이를 구할 수 있다.
378,입체 도형의 부피를 구할 수 있다.
379,속도와 거리에 대한 문제를 해결할 수 있다.
38,"제곱근의 뜻을 알고, 그 성질을 이해한다."
380,"수열의 뜻을 알고, 일반항을 구할 수 있다."
381,"등차수열의 뜻을 알고, 일반항을 구할 수 있다."
382,등차수열의 첫째항부터 제 n 항까지의 합을 구할 수 있다.
383,"등비수열의 뜻을 알고, 일반항을 구할 수 있다."
384,등비수열의 첫째항부터 제 n 항까지의 합을 구할 수 있다.
385,"SIGMA 의 뜻을 알고, 그 성질을 이해하고, 이를 활용할 수 있다."
386,여러가지 수열의 첫째항부터 제 n 항까지의 합을 구할 수 있다.
387,수열의 귀납적 정의를 이해 할 수 있다.
388,"수학적 귀납법의 원리를 이해하고, 이를 이용하여 명제를 증명할 수 있다."
389,"나머지정리의 의미를 이해하고, 이를 활용하여 문제를 해결 할 수 있다."
39,무리수의 개념을 이해한다.
390,식의 값을 구할 수 있다
391,"일차식의 덧셈과 뺄셈의 원리를 이해하고, 그 계산을 할 수 있다"
392,"다항식의 덧셈과 뺄셈의 원리를 이해하고, 그 계산을 할 수 있다."
393,"‘(단항식)×(다항식)’, ‘(다항식)÷(단항식)’과 같은 곱셈과 나눗셈의 원리를 이해하고, 그 계산을 할 수 있다."
4,"일, 십, 백, 천의 자릿값과 위치적 기수법을 이해하고, 네 자릿수를 읽고 쓸 수 있다."
40,실수의 대소 관계를 판단 할 수 있다.
41,근호를 포함한 식의 사칙 계산을 할 수 있다.
43,덧셈과 뺄셈이 이루어지는 실생활 상황을 통하여 덧셈과 뺄셈의 의미를 이해한다.
45,"두 자릿 수의 범위에서 받아 올림이 없는 덧셈과 받아 내림이 없는 뺄셈의 계산 원리를 이해하고, 그 계산을 할 수 있다."
46,"(한 자릿수)+(한 자릿수)=(두 자릿수), (두 자릿수)-(한 자릿수)=(한 자릿수)의 계산 원리를 이해하고 그 계산을 할 수 있다."
47,두 자릿수의 범위에서 받아 올림이 있는 덧셈과 받아 내림이 있는 뺄셈의 계산 원리를 이해하고 그 계산을 할 수 있다.
48,덧셈과 뺄셈의 관계를 이해한다.
49,두 자릿수의 범위에서 세 수의 덧셈과 뺄셈을 할 수 있다.
5,"50까지의 수의 계열을 이해하고, 수의 크기를 비교할 수 있다."
50,"□가 사용된 덧셈식과 뺄셈식을 만들고, □의 값을 구할 수 있다."
51,곱셈이 이루어지는 실생활 상황을 통하여 곱셈의 의미를 이해한다.
52,"곱셈구구를 이해하고, 한자릿수의 곱셈을 할 수 있다."
53,받아 올림이 있는 (세 자릿수)+(세 자릿수)의 계산 원리를 이해하고 그 계산을 할 수 있다.
54,받아 내림이 있는 (세 자릿수)-(세 자릿수)의 계산 원리를 이해하고 그 계산을 할 수 있다.
56,(두 자릿수)×(한 자릿수)와 (세 자릿수)×(한자릿수)의 계산 원리를 이해하고 그 계산을 할 수 있다.
57,(두 자릿수)×(두 자릿수)와 (세 자릿수)×(두 자릿수)의 계산 원리를 이해하고 그 계산을 할 수 있다.
58,곱하는 수가 한 자릿수 또는 두 자릿수인 곱셈에서 계산 결과를 어림할 수 있다.
59,나눗셈이 이루어지는 실생활 상황을 통하여 나눗셈의 의미를 이해한다.
6,"100까지의 수의 계열을 이해하고, 수의 크기를 비교할 수 있다."
60,곱셈과 나눗셈의 관계를 이해한다.
61,"나누는 수가 한 자릿수인 나눗셈의 계산 원리를 이해하고 그 계산을 할 수 있으며, 나눗셈에서 몫과 나머지의 의미를 안다."
62,나누는 수가 두 자릿수인 나눗셈의 계산 원리를 이해하고 그 계산을 할 수 있다.
63,"분모가 같은 분수의 덧셈과 뺄셈의 계산 원리를 이해하고, 그 계산을 할 수 있다."
64,소수 두 자릿수의 범위에서 소수의 덧셈과 뺄셈의 계산 원리를 이해하고 그 계산을 할 수 있다.
65,"덧셈, 뺄셈, 곱셈, 나눗셈의 혼합 계산에서 계산하는 순서를 알고, 혼합 계산을 할 수 있다."
66,분모가 다른 분수의 크기를 비교할 수 있다.
67,"분모가 다른 진분수의덧셈과 뺄셈의 계산 원리를 이해하고, 그 계산을 할 수 있다."
68,분모가 다른 가분수나 대분수의 덧셈과 뺄셈의 계산 원리를 이해하고 그 계산을 할 수 있다
69,"‘(분수)x(자연수)’, ‘(자연수)x(분수)’의 계산 원리를 이해하고 그 계산을 할 수 있다."
7,"세 자릿수의 범위에서 수의 계열을 이해하고, 수의 크기를 비교할 수 있다."
70,‘(분수)x(분수)’의 계산 원리를 이해하고 그 계산을 할 수 있다.
71,‘(자연수)/(자연수)’에서 나눗셈의 몫을 분수로 나타낼 수 있다.
72,‘(분수)/(자연수)’의 계산원리를 이해하고 그 계산을 할 수 있다.
73,"‘(자연수)/(분수)’, ‘(분수)/(분수)’의 계산 원리를 이해하고 그 계산을 할 수 있다."
74,"‘(소수)x(자연수)’, ‘(자연수)x(소수)’의 계산 원리를 이해하고 그 계산을 할 수 있다."
75,‘(소수)x(소수)’의 계산원리를 이해하고 그 계산을 할 수 있다.
76,"‘(자연수)/(자연수)’, ‘(소수)/(자연수)’에서 나눗셈의 몫을 소수로 나타낼 수 있다."
77,"‘(자연수)/(소수)’, ‘(소수)/(소수)’의 계산 원리를 이해하고 그 계산을 할 수 있다."
78,소수의 곱셈과 나눗셈의 계산 결과를 어림할 수 있다.
79,"집합의 개념을 이해하고, 집합을 표현할 수 있다."
8,"네 자릿수의 범위에서수의 계열을 이해하고, 수의 크기를 비교할 수 있다."
80,두 집합 사이의 포함 관계를 이해한다.
81,집합의 연산을 할 수 있다.
82,"명제와 조건의 뜻을 알고, ‘모든’, ‘어떤’을 포함한 명제를 이해한다."
83,명제의 역과 대우를 이해한다.
84,충분조건과 필요조건을 이해하고 구분할 수 있다.
86,"절대부등식의 의미를 이해하고, 간단한 절대부등식을 증명할 수 있다"
87,다양한 상황을 문자를 사용한 식으로 나타낼 수 있다.
88,지수법칙을 이해한다.
89,다항식의 곱셈을 할 수 있다.
9,"하나의 수를 두 수로 분해하고, 두 수를 하나의 수로 합성할 수 있다."
90,다항식의 인수분해를 할 수 있다.
91,다항식의 사칙연산을 할 수 있다.
92,항등식의 성질을 이해한다.
93,다항식의 인수분해를 할 수 있다.
94,방정식과 그 해의 의미를 알 수 있다.
95,등식의 성질을 설명할 수 있다.
96,일차방정식을 풀 수 있다.
97,일차방정식을 활용하여 문제를 해결할 수 있다.
98,"부등식과 그 해의 의미를 알고, 부등식의 성질을 이해한다."
99,일차부등식을 풀 수 있다.
